{
  "api_version": "agent-platform/v1alpha1",
  "kind": "Approval",
  "metadata": {
    "id": "apr_0198f6d0-7ef0-7b0e-a0d3-5f9c96c7f411",
    "revision": 1,
    "scope": {
      "type": "project",
      "tenant_id": "ten_0198f6d0-7ef0-7b0e-a0d3-5f9c96c7f411",
      "user_id": "usr_0198f6d0-7ef0-7b0e-a0d3-5f9c96c7f411",
      "project_id": "prj_0198f6d0-7ef0-7b0e-a0d3-5f9c96c7f411"
    },
    "labels": {},
    "annotations": {},
    "created_at": "2026-09-01T12:15:00Z",
    "created_by": {
      "actor_type": "agent",
      "actor_id": "agt_0198f6d0-7ef0-7b0e-a0d3-5f9c96c7f411"
    }
  },
  "spec": {
    "subject_ref": {
      "kind": "ToolCall",
      "id": "tcl_0198f6d0-7ef0-7b0e-a0d3-5f9c96c7f412"
    },
    "requester": {
      "actor_type": "agent",
      "actor_id": "agt_0198f6d0-7ef0-7b0e-a0d3-5f9c96c7f411"
    },
    "approval_type": "tool_execution",
    "risk_summary": "此操作将修改生产环境配置文件，可能导致服务重启",
    "requested_actions": [
      {
        "action": "file.write",
        "resource": "project:prj_demo/config/production.yaml"
      }
    ],
    "input_digest": "sha256:a1b2c3d4e5f6a1b2c3d4e5f6a1b2c3d4e5f6a1b2c3d4e5f6a1b2c3d4e5f6a1b2",
    "policy_snapshot": {
      "kind": "PermissionProfile",
      "id": "pep_0198f6d0-7ef0-7b0e-a0d3-5f9c96c7f411",
      "version": "1.0.0",
      "digest": "sha256:f6a1b2c3d4e5f6a1b2c3d4e5f6a1b2c3d4e5f6a1b2c3d4e5f6a1b2c3d4e5f6a1"
    },
    "required_approvers": [
      {
        "role": "admin",
        "count": 1,
        "separation_of_duties": true
      }
    ],
    "decisions": [
      {
        "approver": {
          "actor_type": "user",
          "actor_id": "usr_0198f6d0-7ef0-7b0e-a0d3-5f9c96c7f412"
        },
        "decision": "approve",
        "decided_at": "2026-09-01T12:20:00Z",
        "comment": "已确认变更内容，允许执行"
      }
    ],
    "expires_at": "2026-09-01T13:15:00Z",
    "one_time": true,
    "usage_count": 0
  },
  "status": {
    "phase": "approved"
  }
}
